发送特殊协议选项的ping报文，以下通过发送tcp协议的push标志位进行路由发现的
此方法的意义在于穿过防火墙过滤

sudo traceroute -T -O psh www.163.com
traceroute to www.163.com (122.70.142.172), 30 hops max, 40 byte packets
 1  192.168.1.1 (192.168.1.1)  0.992 ms  1.381 ms  1.314 ms
 2  * * *
 3  * * *
 4  * * *
 5  * * *
 6  * * *
 7  * * *
 8  * * *
 9  * * *
10  * * *
11  * * *
12  * * *
13  * * *
14  * * *
15  * * *
16  * * *
17  * * *
18  * * *
19  * * *
20  * * *
21  * * *
22  * * *
23  * * *
24  * * *
25  * * *
26  * * *
27  * * *
28  * * *
29  * * *
30  * * *

以下是tcp特殊协议发送时进行抓包验证的过程，证明我们发的确实是正确的
zhangly@VU16:~/opendaylight-0.10.0/etc$ sudo tcpdump -i ens33
[sudo] password for zhangly: 
tcpdump: verbose output suppressed, use -v or -vv for full protocol decode
listening on ens33, link-type EN10MB (Ethernet), capture size 262144 bytes
23:05:28.003373 IP 192.168.1.13.34233 > 192.168.1.1.domain: 22819+ A? www.163.com. (29)
23:05:28.003707 IP 192.168.1.13.34233 > 192.168.1.1.domain: 48433+ AAAA? www.163.com. (29)
23:05:28.015033 IP 192.168.1.13.34233 > 192.168.1.1.domain: 47455+ PTR? 1.1.168.192.in-addr.arpa. (42)
23:05:28.018453 IP 192.168.1.1.domain > 192.168.1.13.34233: 48433 2/0/0 CNAME www.163.com.lxdns.com., AAAA 2409:8c10::42 (92)
23:05:28.018464 IP 192.168.1.1.domain > 192.168.1.13.34233: 22819 2/0/0 CNAME www.163.com.lxdns.com., A 122.70.142.172 (77)
23:05:28.019625 IP 192.168.1.13.44300 > 122.70.142.172.http: Flags [P], win 5840, length 0
23:05:28.019811 IP 192.168.1.13.60430 > 122.70.142.172.http: Flags [P], win 5840, length 0
23:05:28.069143 IP 192.168.1.13.34233 > 192.168.1.1.domain: 60194+ PTR? 172.142.70.122.in-addr.arpa. (45)
23:05:28.098385 IP 192.168.1.1.domain > 192.168.1.13.34233: 60194 NXDomain 0/0/0 (45)
23:05:33.047425 IP 192.168.1.13.34448 > 122.70.142.172.http: Flags [P], win 5840, length 0
23:05:33.047605 IP 192.168.1.13.50247 > 122.70.142.172.http: Flags [P], win 5840, length 0
23:05:33.047721 IP 192.168.1.13.42962 > 122.70.142.172.http: Flags [P], win 5840, length 0
23:05:33.047828 IP 192.168.1.13.49424 > 122.70.142.172.http: Flags [P], win 5840, length 0
23:05:33.047934 IP 192.168.1.13.48235 > 122.70.142.172.http: Flags [P], win 5840, length 0
23:05:33.048040 IP 192.168.1.13.57774 > 122.70.142.172.http: Flags [P], win 5840, length 0
23:05:33.048148 IP 192.168.1.13.43302 > 122.70.142.172.http: Flags [P], win 5840, length 0
23:05:38.051378 IP 192.168.1.13.55661 > 122.70.142.172.http: Flags [P], win 5840, length 0
23:05:38.051670 IP 192.168.1.13.50951 > 122.70.142.172.http: Flags [P], win 5840, length 0
23:05:38.051973 IP 192.168.1.13.47604 > 122.70.142.172.http: Flags [P], win 5840, length 0
23:05:38.052232 IP 192.168.1.13.52099 > 122.70.142.172.http: Flags [P], win 5840, length 0
23:05:38.052436 IP 192.168.1.13.57035 > 122.70.142.172.http: Flags [P], win 5840, length 0
23:05:38.052598 IP 192.168.1.13.46457 > 122.70.142.172.http: Flags [P], win 5840, length 0
23:05:38.052901 IP 192.168.1.13.42367 > 122.70.142.172.http: Flags [P], win 5840, length 0
23:05:38.055103 IP 192.168.1.13.50902 > 122.70.142.172.http: Flags [P], win 5840, length 0
23:05:38.055300 IP 192.168.1.13.46965 > 122.70.142.172.http: Flags [P], win 5840, length 0
23:05:38.063105 ARP, Request who-has 192.168.1.1 tell 192.168.1.13, length 28
23:05:38.066144 ARP, Reply 192.168.1.1 is-at 20:28:3e:d8:f9:4f (oui Unknown), length 46
23:05:43.065238 IP 192.168.1.13.55966 > 122.70.142.172.http: Flags [P], win 5840, length 0
23:05:43.065439 IP 192.168.1.13.49157 > 122.70.142.172.http: Flags [P], win 5840, length 0
23:05:43.065521 IP 192.168.1.13.45308 > 122.70.142.172.http: Flags [P], win 5840, length 0
23:05:43.065596 IP 192.168.1.13.40728 > 122.70.142.172.http: Flags [P], win 5840, length 0
23:05:43.065670 IP 192.168.1.13.60294 > 122.70.142.172.http: Flags [P], win 5840, length 0
23:05:43.065744 IP 192.168.1.13.45688 > 122.70.142.172.http: Flags [P], win 5840, length 0
23:05:43.065818 IP 192.168.1.13.36023 > 122.70.142.172.http: Flags [P], win 5840, length 0
23:05:48.073081 IP 192.168.1.13.36578 > 122.70.142.172.http: Flags [P], win 5840, length 0
23:05:48.073283 IP 192.168.1.13.60715 > 122.70.142.172.http: Flags [P], win 5840, length 0
23:05:48.073412 IP 192.168.1.13.56161 > 122.70.142.172.http: Flags [P], win 5840, length 0
23:05:48.073588 IP 192.168.1.13.36482 > 122.70.142.172.http: Flags [P], win 5840, length 0
23:05:48.073706 IP 192.168.1.13.43099 > 122.70.142.172.http: Flags [P], win 5840, length 0
23:05:48.073833 IP 192.168.1.13.47181 > 122.70.142.172.http: Flags [P], win 5840, length 0
23:05:48.073949 IP 192.168.1.13.42194 > 122.70.142.172.http: Flags [P], win 5840, length 0
23:05:48.074040 IP 192.168.1.13.38603 > 122.70.142.172.http: Flags [P], win 5840, length 0
23:05:48.074130 IP 192.168.1.13.37503 > 122.70.142.172.http: Flags [P], win 5840, length 0
23:05:48.074245 IP 192.168.1.13.35129 > 122.70.142.172.http: Flags [P], win 5840, length 0
23:05:48.074360 IP 192.168.1.13.45125 > 122.70.142.172.http: Flags [P], win 5840, length 0
23:05:48.074476 IP 192.168.1.13.37348 > 122.70.142.172.http: Flags [P], win 5840, length 0
23:05:48.074653 IP 192.168.1.13.37257 > 122.70.142.172.http: Flags [P], win 5840, length 0
23:05:48.074747 IP 192.168.1.13.57893 > 122.70.142.172.http: Flags [P], win 5840, length 0
23:05:48.074870 IP 192.168.1.13.52552 > 122.70.142.172.http: Flags [P], win 5840, length 0
23:05:48.074984 IP 192.168.1.13.36519 > 122.70.142.172.http: Flags [P], win 5840, length 0
23:05:53.083048 IP 192.168.1.13.49861 > 122.70.142.172.http: Flags [P], win 5840, length 0
23:05:53.083225 IP 192.168.1.13.36949 > 122.70.142.172.http: Flags [P], win 5840, length 0
23:05:53.083333 IP 192.168.1.13.35626 > 122.70.142.172.http: Flags [P], win 5840, length 0
23:05:53.083451 IP 192.168.1.13.54133 > 122.70.142.172.http: Flags [P], win 5840, length 0
23:05:53.083551 IP 192.168.1.13.49713 > 122.70.142.172.http: Flags [P], win 5840, length 0
23:05:53.083746 IP 192.168.1.13.33870 > 122.70.142.172.http: Flags [P], win 5840, length 0
23:05:53.083862 IP 192.168.1.13.40690 > 122.70.142.172.http: Flags [P], win 5840, length 0
23:05:59.482409 IP 192.168.1.13.58282 > 91.189.89.198.ntp: NTPv4, Client, length 48

